<?xml version="1.0" encoding="UTF-8"?>
<cv xmlns:xsi="http://www.w3.org/2001/XMLSchema-instance" xsi:noNamespaceSchemaLocation="cv.xsd" international="false">
	<person>
		<forename>Simon</forename>
		<name>Honegger</name>
		<title>Bachelor of Science HES-SO in Informatik</title>
		<contact>
			<address>
				<street>Varis</street>
				<streetnumber>9</streetnumber>
				<zip countryIsoCode="CH">1700</zip>
				<location>Fribourg</location>
			</address>
			<!--phone type="homePhone">
				<countryCode>41</countryCode>
				<areaCode>43</areaCode>
				<number>535 68 44</number>
			</phone-->
			<phone type="cellPhone">
				<countryCode>41</countryCode>
				<areaCode>76</areaCode>
				<number>386 82 56</number>
			</phone>
			<email>simon.honegger@edu.hefr.ch</email>
		</contact>
		<experience>5</experience>
		<birthday day="22" month="7" year="1984"/>
		<hometown>Niederhasli ZH</hometown>
		<maritalStatus>ledig</maritalStatus>
		<picture>cv_honegger_photo_3_mod2_cmp.jpg</picture>
	</person>
	<educations title="Ausbildung">
		<education>
			<description>Zweisprachiges Studium an der Ecole d'ingénieurs et d'architectes de Fribourg</description>
			<from year="2008"/>
			<to year="2011"/>
			<certificate>Bachelor of Science HES-SO in Informatik (bilingue Franz./Deutsch)</certificate>
		</education>
		<education>
			<description>Lehre als KV-Informatiker in der Zürcher Kantonalbank</description>
			<from year="2000"/>
			<to year="2003"/>
			<certificate>Fähigkeitsausweis Branche Informatik-Anwendungsentwicklung</certificate>
		</education>
		<education>
			<description>KV Zürich Business School</description>
			<from year="2000"/>
			<to year="2003"/>
			<certificate>Kaufmännische Berufsmaturität</certificate>
		</education>
	</educations>
	<experiences title="Berufserfahrung">
		<experiance>
			<company>Zürcher Kantonalbank</company>
            <period>
				<from year="2010" month="06"/>
				<to year="2010" month="08"/>
                <function>Applikationsentwickler auf Stundenlohnbasis</function>
				<project title="ACS (Zutritts- und Zugriffsrechteverwaltung) Rel. 2.1">
					<activity>Kundennahe Umsetzung von fachlichen Anforderungen nach Scrum Rahmenwerk</activity>
                    <activity>Implementieren, testen und presentieren dieser Anforderungen (Apache Wicket, Spring, Hibernate, LDAP)</activity>
				</project>
			</period>
            <period>
				<from year="2010" month="01"/>
				<to year="2010" month="02"/>
                <function>Aushilfe auf Stundenlohnbasis</function>
				<project title="Match E4 Testing">
					<activity>Kosten-Nutzen-Analyse diverser Optimierungen im Testprozess</activity>
				</project>
			</period>			
            <period>
				<from year="2003" month="08"/>
				<to year="2008" month="10"/>
                <function>Applikationsentwickler in Festanstellung</function>
                <project title="TAB/REF Ablösung (Migration der Referenzdaten von Mainfraime zu dezentral)">
					<activity>Mitentwicklung der PL/1 Schnittstelle auf dezentrale Services (C++)</activity>
					<activity>Performance Analyse des Zugriffs auf alte bzw. neue Datenhaltung</activity>
					<activity>Modellieren und Realisieren von Interface Business Objects (XML)</activity>
					<activity>Realisieren eines Generators zur dynamischen Erstellung von Static SQL (Java)</activity>
				</project>
				<project title="PSV ASD/SDV (Produktions Support Vereinbarung Stammdatenverwaltung)">
					<activity>Sicherstellen der Service Level Agreements im Bereich ADB (Datawarehouse) Belieferung</activity>
					<activity>Durchführen von Systembuilds in der Stammdatenverwaltung</activity>
				</project>
				<project title="Migration Bestandesführung Geld Rel. 2.0 ">
					<activity>Realisieren eines Servicemoduls in PL/1 inkl. Regressionstests</activity>
				</project>
				<project title="SDS (Stammdaten-Services) Rel. 1.0 (Neuentwicklung der Stammdatenapplikation)">
					<activity>Analyse, Spezifikation, Design, Implementation und Test diverser Java Softwarekomponenten</activity>
				</project>
				<project title="SDS (Stammdaten-Services) Rel. 2.0 (Folgeprojekt von SDS R1.0)">
					<activity>Stellvertretung des Teilprojektleiters ASD/SDS GUI</activity>
					<activity>Realisieren eines ASD/SDS GUI Prototyps in Java inkl. Präsentation am Projektgesamtmeeting</activity>
					<activity>Spezifikation der Java Software Komponente ASD/SDS GUI und codierung des generischen Teils</activity>
					<activity>Abstimmung der Realisierung der fachlichen Anforderungen mit dem Fachbereich</activity>
				</project>
				<project title="Zentrale Führung der VV-Codierung">
					<activity>Teilprolektleitung ASD/SDS</activity>
					<activity>Definition des bankfachlichen Modells und Konsistenzbedingungen mit dem Fachbereich</activity>
					<activity>Implemention nach MDA (Model Driven Architecture) Ansatz</activity>
				</project>
			</period>
		</experiance>
	</experiences>
	<training title="Weiterbildungen">
		<education>
			<description>Object Oriented Analysis and Design with UML (Zühlke)</description>
			<date year="2008" month="1"/>
		</education>
        <education>
			<description>Synergy Ugrade 6.5 (Telelogic)</description>
			<date year="2007" month="7"/>
		</education>
		<education>
			<description>Java - Design Patterns (IBM)</description>
			<date year="2006" month="11"/>
		</education>
		<education>
			<description>DB2 UDB for z/OS - Anwendungsprogrammierung (IBM)</description>
			<date year="2005" month="11"/>
		</education>
		<education>
			<description>PL/1 Grundlagen (IFA)</description>
			<date year="2005" month="4"/>
		</education>
		<education>
			<description>Synergy / CM Build-Manager (Telelogic)</description>
			<date year="2004" month="3"/>
		</education>
	</training>
	<certificats title="Zertifikate">
        <certificat>
			<description>Certified Secure Web Developer (CSWD)</description>
			<date year="2011"/>
		</certificat>
		<certificat>
			<description>OMG-Certified UML Professionals (OCUP)</description>
			<date year="2005"/>
		</certificat>
	</certificats>
	<skills title="Kompetenzen">
		<skillgroup title="Sprachen">
			<solidskill etc="false">
                <skill>Java</skill>
			    <skill>C/C++</skill>
			    <skill>XML</skill>
			    <skill>LaTeX</skill>
			    <skill>Python</skill>
			    <skill>bash</skill>
			    <skill>PL/I</skill>
			    <skill></skill>
            </solidskill>
			<goodskill etc="true">
			    <skill>HTML/CSS</skill>
			    <skill>C#</skill>
			    <skill>Visual Basic</skill>
			    <skill>Objective-C</skill>
            </goodskill>
		</skillgroup>
        <skillgroup title="Frameworks">
            <solidskill etc="false">
			    <skill>Apache Wicket</skill>
			    <skill>Qt</skill>
                <skill>JUnit</skill>
            </solidskill>
            <goodskill etc="true">
			    <skill>.NET</skill>
			    <skill>Hibernate</skill>
			    <skill>GWT</skill>
				<skill>Spring</skill>
                <skill>Servlets</skill>
            </goodskill>
        </skillgroup>
        <skillgroup title="Datenbanken">
            <solidskill etc="false">
			    <skill>DB2</skill>
			    <skill>LDAP</skill>
            </solidskill>
            <goodskill etc="false">
			    <skill>Oracle</skill>
			    <skill>MySQL</skill>
			    <skill>SQL Server</skill>
                <skill>HSQLDB</skill>
            </goodskill>
        </skillgroup>
        <skillgroup title="Programme">
            <solidskill etc="false">
			    <skill>itelliJ</skill>
			    <skill>Eclipse</skill>
                <skill>QtCreator</skill>
			    <skill>Rational Rose</skill>
			    <skill>Enterprise Architekt</skill>
			    <skill>Visual Paradigm UML</skill>
                <skill>Office suite</skill>
            </solidskill>
            <goodskill etc="true">
			    <skill>Visual Studio</skill>
			    <skill>Xcode</skill>
                <skill>make</skill>
            </goodskill>
		</skillgroup>				
        <skillgroup title="Umgebungen">
			<solidskill etc="false">
			    <skill>Linux (Ubuntu)</skill>
			    <skill>Windows</skill>
			    <skill>z/OS</skill>
			</solidskill>
			<goodskill etc="false">
			    <skill>Unix (AIX)</skill>
			    <skill>Mac OS X</skill>
			    <skill>USS (Unix System Services)</skill>
            </goodskill>
		</skillgroup>
	</skills>
	<languages title="Sprachen">
		<language name="Deutsch">
			<skill>native</skill>
		</language>
		<language name="Französisch">
			<skill>fluent</skill>
		</language>
		<language name="Englisch">
			<skill>good</skill>
		</language>
	</languages>
	<!--<hobbys title="Hobbies">
		<hobby>Unihockey</hobby>
		<hobby>Snowboarden</hobby>
		<hobby>Stricken</hobby>
		<hobby>Lesen</hobby>
	</hobbys>-->
	<references title="Referenzen" ondemande="true">
		<!--<reference>
			<forename>Klara</forename>
			<name>Kioalafas</name>
			<position>Leiterin Entwicklung</position>
			<company>Zürcher Kantonalbank</company>
		</reference>
		<reference>
			<forename>Ogün</forename>
			<name>Cetin</name>
			<position>Projektleiter</position>
			<company>Zürcher Kantonalbank</company>
		</reference>-->
	</references>
    <begin title="Mögliche Anstellung" immediatly="true" />
</cv>
