<?xml version="1.0" encoding="UTF-8"?>
<cv xmlns:xsi="http://www.w3.org/2001/XMLSchema-instance" xsi:noNamespaceSchemaLocation="cv.xsd" international="false">
	<person>
		<forename>Simon</forename>
		<name>Honegger</name>
		<title>Bachelor of Science HES-SO in Informatik</title>
		<contact>
			<address>
				<street>Rue de Bouchers</street>
				<streetnumber>1</streetnumber>
				<zip countryIsoCode="CH">1700</zip>
				<location>Fribourg</location>
			</address>
			<phone type="homePhone">
				<countryCode>41</countryCode>
				<areaCode>43</areaCode>
				<number>535 68 44</number>
			</phone>
			<phone type="cellPhone">
				<countryCode>41</countryCode>
				<areaCode>76</areaCode>
				<number>386 82 56</number>
			</phone>
			<email>simon.honegger@edu.hefr.ch</email>
		</contact>
		<experience>5</experience>
		<picture>cv_honegger_photo.jpg</picture>
	</person>
	<skills title="Kompetenzen">
		<skillgroup etc="true" title="Programme">
			<skill>Office suite</skill>
			<skill>itelliJ</skill>
			<skill>Eclipse</skill>
			<skill>Visual Studio</skill>
			<skill>Rational Rose</skill>
			<skill>Enterprise Architekt</skill>
			<skill>Xilinx ISE / ModelSim</skill>
		</skillgroup>
		<skillgroup etc="false" title="Sprachen">
			<skill>Java</skill>
			<skill>C/C++</skill>
			<skill>C#</skill>
			<skill>HTML</skill>
			<skill>XML</skill>
			<skill>VHDL</skill>
			<skill>Python</skill>
			<skill>bash</skill>
			<skill>Visual Basic</skill>
			<skill>.Net</skill>
			<skill>PL/I</skill>
			<skill>Delta</skill>
		</skillgroup>
		<skillgroup etc="false" title="Umgebungen">
			<skill>Windows</skill>
			<skill>Unix(AIX)</skill>
			<skill>Linux(Ubuntu)</skill>
			<skill>USS (Unix System Services)</skill>
			<skill>OS/390</skill>
			<skill>DB2</skill>
			<skill>Oracle</skill>
		</skillgroup>
	</skills>
	<educations title="Ausbildung">
		<education>
			<description>Zweisprachiges Studium an der Ecole d'ingénieurs et d'architectes de Fribourg</description>
			<from year="2008" month="8"/>
			<to year="2011" month="8"/>
			<certificate>Bachelor of Science HES-SO bilingue in Informatik</certificate>
		</education>
		<education>
			<description>Lehre als KV-Informatiker in der Zürcher Kantonalbank</description>
			<from year="2000" month="08"/>
			<to year="2003" month="08"/>
			<certificate>Fähigkeitsausweis Branche Informatik</certificate>
			<certificate>Applikationsentwickler I</certificate>
		</education>
		<education>
			<description>KV Zürich Business School</description>
			<from year="2000" month="08"/>
			<to year="2003" month="08"/>
			<certificate>kaufmännische Berufsmaturität</certificate>
		</education>
	</educations>
	<educations title="Technische Ausbildung">
		<education>
			<description>Synergy / CM Build-Manager (Telelogic)</description>
			<date year="2004" month="3"/>
		</education>
		<education>
			<description>Synergy Ugrade 6.5 (Telelogic)</description>
			<date year="2007" month="7"/>
		</education>
		<education>
			<description>Java - Design Patterns (IBM)</description>
			<date year="2006" month="11"/>
		</education>
		<education>
			<description>DB2 UDB for z/OS - Anwendungsprogrammierung (IBM)</description>
			<date year="2005" month="11"/>
		</education>
		<education>
			<description>PL/1 Grundlagen (IFA)</description>
			<date year="2005" month="4"/>
		</education>
		<education>
			<description>Object Oriented Analysis and Design with UML (Zühlke)</description>
			<date year="2008" month="1"/>
		</education>
	</educations>
	<certificats title="Zertifikate">
		<certificat>
			<description>OMG-Certified UML Professtionals</description>
			<date year="2005"/>
		</certificat>
	</certificats>
	<experiences title="Berufserfahrung">
		<experiance>
			<company>Zürcher Kantonalbank</company>
			<from year="2003" month="08"/>
			<to year="2008" month="10"/>
			<project title="PSV ASD/SDV (Produktions Support Vereinbarung Allgemeine Stammdaten / Stammdatenverwaltung)">
				<activity>
				Modellieren und Realisieren der fachlichen Lieferobjekte (IBO — Interface Business Objects) für ADB (Allgemeine Datenbasis) in ASD/SDV 
				</activity>
				<activity>
				Sicherstellen der SLA's (Service Level Agreements) im Bereich ADB Belieferung 
				</activity>
				<activity>
				Durchführen von Systembuilds der Applikation ASD/SDV
				</activity>
				<activity>
				Realisieren eines Generators zur dynamischen Erstellung von Static SQL
				</activity>
			</project>
			<project title="Projekt Migration Bestandesführung Geld Rel. 2.0 ">
				<activity>Realisieren eines mandantenfähigen Servicemoduls in PL1 inklusive Erstellung der dazugehörigen Regressionstests</activity>
			</project>
			<project title="Projekt SDS (Stammdaten-Services) Rel. 1.0 (Neuentwicklung der Stammdatenapplikation der ZKB)">
				<activity>Erstellen der Anforderungsspezifikation der Software Komponente SDS Filler inklusive Einarbeitung des Feedbacks aus dem offiziellem Review</activity>
				<activity>Analyse und Erstellung des Systemdesigns der Software Komponente CIF (Customer Information File) Update Manager</activity>
				<activity>Analyse, Design, Implementieren und Testen der Java Software Komponente CIF Snapshot (der CIF Snapshot bereitet die benötigten CIF Daten für den SDS Filler auf)</activity>
			</project>
			<project title="Projekt SDS (Stammdaten-Services) Rel. 2.0 (Folgeprojekt von SDS R1.0)">
				<activity>Erstellen der Anforderungsspezifikation der Java Software Komponente ASD/SDS GUI</activity>
				<activity>Realisieren eines ASD/SDS GUI Prototyps in Java, inkl. Präsentation am Projektgesamtmeeting</activity>
				<activity>Codieren des generischen Teil des ASD/SDS GUI in Java</activity>
				<activity>Teilnahme an regelmässigen Sitzungen mit dem Fachbereich zwecks Abstimmung der Realisierung der gestellten fachlichen Anforderungen</activity>
				<activity>Refactoring des Java Codes für das ASD/SDS GUI</activity>
				<activity>Realisierung von JUnit Testklassen für den Unittest des generischen ASD/SDS GUI</activity>
				<activity>Dokumentation des Codes mittels JavaDoc</activity>
				<activity>Stellvertretung des Teilprojektleiters ASD/SDS GUI</activity>
				<activity>Teilnahme an regelmässigen Sitzungen mit den Testern zwecks Abstimmung der gemeldeten und behobenen Defects</activity>
			</project>
			<project title="Projekt Zentrale Führung der VV-Codierung">
				<activity>Teilprolektleitung ASD/SDS</activity>
				<activity>Koordination und Planung des Teilprojektes ASD/SDS</activity>
				<activity>Verifizierung des bankfachlichen Modells mit dem Fachbereich</activity>
				<activity>Definieren der bankfachlichen Konsistenzbedingungen für die Datenbewirtschaftung</activity>
				<activity>Einpflegen der Metadaten und Generieren der Artefakte (DB2 DDL, Java API, HTML Doku, PL1 Strukturen) basierend auf einem MDA (Model Driven Architecture) Ansatz</activity>
				<activity>Implementieren der Konsistenzbedingungen sowie des Initial Loads in Java</activity>
			</project>
		</experiance>
	</experiences>
	<languages title="Sprachen">
		<language name="Deutsch">
			<skill>native</skill>
		</language>
		<language name="Französisch">
			<skill>C1</skill>
		</language>
		<language name="Englisch">
			<skill>B2</skill>
		</language>
	</languages>
	<hobbys title="Hobbies">
		<hobby>Unihockey</hobby>
		<hobby>Snowboarden</hobby>
		<hobby>Stricken</hobby>
		<hobby>Lesen</hobby>
	</hobbys>
	<references title="Referenzen">
		<reference>
			<forename>Klara</forename>
			<name>Kioalafas</name>
			<position>Leiterin Entwicklung</position>
			<company>Zürcher Kantonalbank</company>
		</reference>
		<reference>
			<forename>Ogün</forename>
			<name>Cetin</name>
			<position>Projektleiter</position>
			<company>Zürcher Kantonalbank</company>
		</reference>
	</references>
</cv>
